淘宝ID,价格,专柜价,标题,图片
13391238503,1080.0,1080.0,New Balance/新百伦 女装 羽绒服 抗寒保暖冬装 AWSJ1311 包邮,http://img03.taobaocdn.com/bao/uploaded/i3/T1WTeEXXpXXXc5bWvX_114210.jpg_210x210.jpg
16337045173,1280.0,1280.0,New Balance/新百伦 女装 羽绒服 AWSJ2306,http://img03.taobaocdn.com/bao/uploaded/i3/T1aRT6XfBbXXXnjV32_043054.jpg_210x210.jpg
16215401591,168.0,168.0,newbalance/新百伦 女衣 圆领短袖T恤 AWGT9251 包邮,http://img04.taobaocdn.com/bao/uploaded/i4/T1Mzb6XaxcXXb6sHs1_040316.jpg_210x210.jpg
16215601789,328.0,328.0,newbalance/新百伦 男衣 梭织长裤 MRP03390,http://img02.taobaocdn.com/bao/uploaded/i2/T1QKL6XdtdXXcLXGsZ_031314.jpg_210x210.jpg
17563739492,898.0,898.0,newbalance/新百伦 女衣 羽绒服 WOJ03050抗寒保暖棉服 包邮,http://img02.taobaocdn.com/bao/uploaded/i2/T1.y25XntgXXbaq3jb_123821.jpg_210x210.jpg
20500396540,448.0,448.0,newbalance/新百伦 男/女款长袖针织套衫 NC141113休闲运动卫衣,http://img03.taobaocdn.com/bao/uploaded/i3/T1dJY5XgdgXXXfrY2b_123255.jpg_210x210.jpg
17563035240,348.0,348.0,newbalance/新百伦 男衣 长袖针织外套 MEJ03710,http://img01.taobaocdn.com/bao/uploaded/i1/T1t._5XaFfXXcDsVzb_122647.jpg_210x210.jpg
20499984852,328.0,328.0,newbalance/新百伦 男衣 长袖针织套衫 MET13010,http://img01.taobaocdn.com/bao/uploaded/i1/T10e26Xm0cXXXlbX_b_123026.jpg_210x210.jpg
17563707130,428.0,428.0,newblance/新百伦 女衣 长袖针织套衫 AWLJ1325,http://img02.taobaocdn.com/bao/uploaded/i2/T1eKjYXhpnXXcj.Sfa_122236.jpg_210x210.jpg
17563703507,528.0,528.0,newbalance/新百伦 女衣 长袖梭织外套 AWLJ1322 包邮,http://img02.taobaocdn.com/bao/uploaded/i2/T15sr7XmFXXXXmq9na_121944.jpg_210x210.jpg
16332462850,1280.0,1280.0,New Balance/新百伦 男款 冬装 羽绒服 AMSJ2303,http://img03.taobaocdn.com/bao/uploaded/i3/T1U725XdxfXXcO48na_121827.jpg_210x210.jpg
16216229981,998.0,998.0,newbalance/新百伦 男衣 羽绒服 AMSJ2302 超保暖鸭绒棉服 包邮,http://img01.taobaocdn.com/bao/uploaded/i1/T16fT6XjJcXXco1z2a_121645.jpg_210x210.jpg
17723427652,958.0,958.0,New Balance/新百伦 男衣 羽绒服 超保暖鸭绒秋冬装 AMSJ1304,http://img04.taobaocdn.com/bao/uploaded/i4/T1Ef_3XeBjXXXUm5va_121447.jpg_210x210.jpg
20501716179,428.0,428.0,newbalance/新百伦 男衣 长袖针织外套 AMLJ1325 休闲运动上衣,http://img01.taobaocdn.com/bao/uploaded/i1/T17vj5XdNiXXaUiJna_120512.jpg_210x210.jpg
13790791623,998.0,998.0,New Balance/新百伦 女款 冬装 超保暖鸭绒羽绒服 AWSJ1310 包邮,http://img01.taobaocdn.com/bao/uploaded/i1/T1s61EXoNgXXcip9k4_053814.jpg_210x210.jpg
13389013498,1180.0,1180.0,New Balance/新百伦 男款 超保暖鸭绒羽绒服 AMSJ1305 包邮,http://img03.taobaocdn.com/bao/uploaded/i3/T18wyEXghsXXcuYmc3_051148.jpg_210x210.jpg
20499972129,368.0,368.0,newbalance/新百伦 女装 梭织长裤 WRP23570 休闲运动裤 包邮,http://img02.taobaocdn.com/bao/uploaded/i2/T1vnY3XeFhXXbYsj39_103910.jpg_210x210.jpg
20484004613,368.0,368.0,newbalance/新百伦 男款 梭织长裤MRP23570  休闲运动裤 包邮,http://img02.taobaocdn.com/bao/uploaded/i2/T17ODVXahoXXb6kKM9_103228.jpg_210x210.jpg
16215065275,298.0,298.0,newbalance/新百伦 男衣 纯棉针织长裤 MEP23900 灰色 黑色 包邮,http://img03.taobaocdn.com/bao/uploaded/i3/T14JDZXhtkXXbjPJs9_102755.jpg_210x210.jpg
20499836261,248.0,248.0,Newbalance/新百伦 AWFT0202 女衣 无袖健身运动背心 包邮,http://img01.taobaocdn.com/bao/uploaded/i1/T1IOD6XgXcXXX0MKA9_102915.jpg_210x210.jpg
9623740651,398.0,398.0,New Balance/新百伦 女款长袖梭织外套 AWRJ0334,http://img03.taobaocdn.com/bao/uploaded/i3/T11nh.XelwXXXxCQg8_101305.jpg_210x210.jpg
13997061732,428.0,428.0,New Balance/新百伦 男 休闲运动外套 长袖针织套衫AMSJ2103 包邮,http://img04.taobaocdn.com/bao/uploaded/i4/T1FdKWXdthXXau6Ms4_052754.jpg_210x210.jpg
13999002815,298.0,298.0,NewBalance/新百伦 女款梭织长裤 休闲运动裤 AWSP1315 特价包邮,http://img01.taobaocdn.com/bao/uploaded/i1/T1GIaWXftnXXcsuLM9_103351.jpg_210x210.jpg
13999050653,368.0,368.0,NewBalance/新百伦 男款 休闲运动裤 针织长裤 AMSP2104特价包邮,http://img01.taobaocdn.com/bao/uploaded/i1/T1jwWWXnRdXXbdKjs9_103828.jpg_210x210.jpg
15911652373,368.0,368.0,NewBalance/新百伦女款长袖梭织外套 休闲运动服装AWSJ1314特价,http://img01.taobaocdn.com/bao/uploaded/i1/T1n4SWXh8XXXbEEi.4_053412.jpg_210x210.jpg
15916484623,428.0,428.0,NewBalance/新百伦 女装长袖针织外套 运动休闲上衣AWSJ2105特价,http://img04.taobaocdn.com/bao/uploaded/i4/T1_pKWXddtXXXRW_w8_102016.jpg_210x210.jpg
14606899408,368.0,368.0,New Balance/新百伦 女款针织长裤 休闲运动长裤AWSP2106特价包邮,http://img03.taobaocdn.com/bao/uploaded/i3/T1DiOWXhBaXXa2sSw9_104522.jpg_210x210.jpg
20629064914,398.0,398.0,New Balance/新百伦 休闲女裤 长裤 AWHP0335,http://img02.taobaocdn.com/bao/uploaded/i2/T1QjL0XeJcXXb1sdk__075700.jpg_210x210.jpg
16277473263,398.0,398.0,NewBalance/新百伦 男装休闲运动外套 AMRJ0334,http://img02.taobaocdn.com/bao/uploaded/i2/T1XlKBXdx0XXapd5M4_053345.jpg_210x210.jpg
13005861346,328.0,328.0,New Balance/新百伦 女款梭织长裤 AWEP0370,http://img03.taobaocdn.com/bao/uploaded/i3/T1nYqwXehwXXbw6gA5_055719.jpg_210x210.jpg
13004882957,690.0,1380.0,New Balance/新百伦 女款棉服 WOJ03070,http://img03.taobaocdn.com/bao/uploaded/i3/T1EQSvXkJSXXatKsQ6_060859.jpg_210x210.jpg
16204446182,298.0,298.0,newbalance/新百伦 男衣 长袖针织套衫 运动休闲AMST2321 正品,http://img03.taobaocdn.com/bao/uploaded/i3/T1BM2YXbXhXXboZQ33_051014.jpg_210x210.jpg
20629508389,368.0,368.0,NewBalance/新百伦 男装 长袖连帽外套 AMEJ0372 灰色/红色/黑色,http://img03.taobaocdn.com/bao/uploaded/i3/T1QKj6XotbXXXJQGja_120122.jpg_210x210.jpg
16274394937,368.0,368.0,New Balance/新百伦 男款套衫 长袖外套AMHJ0303,http://img01.taobaocdn.com/bao/uploaded/i1/T15Mn0XoRdXXagsl3__080403.jpg_210x210.jpg
14606619407,298.0,298.0,New Balance/新百伦 男款梭织长裤 AMSP1313,http://img01.taobaocdn.com/bao/uploaded/i1/T17gGWXc4eXXaZsJc9_103029.jpg_210x210.jpg
13004842379,428.0,428.0,NewBalance/新百伦 女装长袖针织外套 纯色休闲运动上衣WOJ03010,http://img02.taobaocdn.com/bao/uploaded/i2/T1AFawXeF_XXaCQevX_115020.jpg_210x210.jpg
8839870989,368.0,368.0,New Balance/新百伦 男装长袖针织外套 AMHJ0304立领运动开衫正品,http://img01.taobaocdn.com/bao/uploaded/i1/T1y.p.Xa4BXXX2lv.1_041214.jpg_210x210.jpg
15093079776,498.0,498.0,New Balance/新百伦情侣款 针织长袖衫 连帽休闲卫衣外套MD21D001,http://img02.taobaocdn.com/bao/uploaded/i2/T1bGG8XbJeXXburHnb_123201.jpg_210x210.jpg
13862746629,498.0,498.0,New Balance/新百伦 男装长袖梭织外套 训练运动休闲上衣MAJ21220,http://img03.taobaocdn.com/bao/uploaded/i3/T136GSXlxkXXcpDfTX_114901.jpg_210x210.jpg
14426547525,498.0,498.0,New Balance/新百伦 女装长袖梭织外套 春秋休闲运动上衣WAJ21060,http://img03.taobaocdn.com/bao/uploaded/i3/T10NCSXbxoXXc4zeDa_120654.jpg_210x210.jpg
15635612669,468.0,468.0,New Balance/新百伦 女装 春秋休闲运动长袖梭织连帽外套WAJ21080,http://img04.taobaocdn.com/bao/uploaded/i4/T1dn1SXexbXXbTEv6a_121143.jpg_210x210.jpg
15635708786,428.0,428.0,NewBalance/新百伦 女装长袖梭织外套 时尚训练运动上衣WAJ21090,http://img03.taobaocdn.com/bao/uploaded/i3/T1luKSXeJvXXXsakva_122015.jpg_210x210.jpg
20604404253,499.0,499.0,New Balance/新百伦 女鞋 运动鞋 跑步鞋 WR360R10,http://img02.taobaocdn.com/bao/uploaded/i2/T1qy6YXkllXXcFM9A4_053840.jpg_210x210.jpg
17551095255,38.0,38.0,newbalance/新百伦 女袜 短袜 SKAW0413,http://img02.taobaocdn.com/bao/uploaded/i2/T1.or6XjJaXXbCDKjb_123553.jpg_210x210.jpg
14828644402,699.0,699.0,New Balance新百伦 情侣鞋 男/女鞋 574龙鞋 ML574DLE/DOR/DBK,http://img03.taobaocdn.com/bao/uploaded/i3/T1Op50XfXgXXapxFk._111117.jpg_210x210.jpg
12313115546,699.0,699.0,New Balance/新百伦 女鞋 轻量避震跑步鞋 W790SO10 包邮,http://img03.taobaocdn.com/bao/uploaded/i3/T1WdK0XghmXXcUcUs5_060317.jpg_210x210.jpg
16021305366,599.0,599.0,NewBalance/新百伦 情侣鞋 复古跑步鞋 U420SNP0/SNG0/SNB0特价,http://img03.taobaocdn.com/bao/uploaded/i3/T1OXnQXg4iXXcaAtE__105726.jpg_210x210.jpg
13392665577,999.0,999.0,New Balance/新百伦 男鞋登山鞋 MO673BK0/MB0/SB0,http://img01.taobaocdn.com/bao/uploaded/i1/T1N6bWXiBpXXbCo5oT_012233.jpg_210x210.jpg
16332274766,659.0,659.0,New Balance/新百伦 女鞋 轻量跑步鞋 透气耐穿运动鞋WW10BK00,http://img01.taobaocdn.com/bao/uploaded/i1/T1Sb65XnRgXXXRx_Z9_105011.jpg_210x210.jpg
17222255992,559.0,559.0,New Balance/新百伦情侣鞋男/女鞋透气跑步鞋 M360GOW0 M360NYW0,http://img02.taobaocdn.com/bao/uploaded/i2/T1hX_MXeNiXXXXQ.Z._114013.jpg_210x210.jpg
14627504539,799.0,799.0,【正品热卖】New Balance/新百伦 男鞋 户外靴H800W H800D H800B,http://img03.taobaocdn.com/bao/uploaded/i3/T1Ebi0XmRgXXc4cB31_041946.jpg_210x210.jpg
16337009051,659.0,659.0,NewBalance/新百伦 男鞋 轻量跑步鞋 多功能训练鞋MX20WL00 包邮,http://img01.taobaocdn.com/bao/uploaded/i1/T13_b4Xe8iXXX5zUE9_105102.jpg_210x210.jpg
20454560212,459.0,459.0,New Balance/新百伦男鞋 运动鞋 跑步鞋M366NO00 新品,http://img02.taobaocdn.com/bao/uploaded/i2/T1TvvVXl8iXXa62DwY_030636.jpg_210x210.jpg
19415784895,699.0,699.0,NewBalance/新百伦 男鞋 复古健步鞋 休闲运动鞋MW880DN0/GY0,http://img01.taobaocdn.com/bao/uploaded/i1/T1276FXnliXXa6Z5c5_055925.jpg_210x210.jpg
16207917816,659.0,659.0,newbalance/新百伦 情侣款 复古鞋 U420SLKS/U420SLGS/U420SLBS,http://img04.taobaocdn.com/bao/uploaded/i4/T1Ee_0XcxXXXacG_o7_065750.jpg_210x210.jpg
16207053280,499.0,499.0,newbalance/新百伦 情侣款 复古鞋 M400NKP0/M400NBP0,http://img02.taobaocdn.com/bao/uploaded/i2/T1aez0XiBXXXc3l_I6_063150.jpg_210x210.jpg
16391605135,499.0,499.0,newbalance/新百伦 男鞋 户外跑步鞋 MT470GY3 包邮,http://img02.taobaocdn.com/bao/uploaded/i2/T1wer5Xn4eXXbJNE74_054449.jpg_210x210.jpg
10581354309,38.0,38.0,【正品特惠】New Balance/新百伦 男短袜三色可选 SKAM0413,http://img02.taobaocdn.com/bao/uploaded/i2/T1nVueXiFtXXaY4Bo0_035938.jpg_210x210.jpg
16289121255,459.0,459.0,New Balance/新百伦 女鞋 复古鞋 W364LBK0 W364LDB0 包邮,http://img01.taobaocdn.com/bao/uploaded/i1/T1Cxj0XiJdXXXouHDc_095847.jpg_210x210.jpg
16285834444,590.0,590.0,New Balance/新百伦 女鞋 复古鞋 跑步鞋 S470SSB0,http://img01.taobaocdn.com/bao/uploaded/i1/T1U8H1XcpXXXaqzAM8_101351.jpg_210x210.jpg
20482164917,599.0,599.0,newbalance/新百伦 男鞋 跑步鞋 透气防滑运动鞋 M570NV20 包邮,http://img03.taobaocdn.com/bao/uploaded/i3/T1fZTZXnlfXXa17K_X_085105.jpg_210x210.jpg
16206461188,459.0,459.0,Newbalance/新百伦 男鞋 经典复古鞋 M373GWR0/BWG0/SWN0/GRS0,http://img02.taobaocdn.com/bao/uploaded/i2/T1bYnZXcFhXXXXFHQ9_102551.jpg_210x210.jpg
20483424203,459.0,459.0,Newbalance/新百伦 女鞋 复古鞋 跑步鞋W373MNB0/W373MPN0 包邮,http://img04.taobaocdn.com/bao/uploaded/i8/T1vwnZXlxdXXc.OK.8_070341.jpg_210x210.jpg
16289457035,899.0,899.0,New Balance/新百伦 男鞋 男户外鞋 MO1000RB,http://img01.taobaocdn.com/bao/uploaded/i1/T1fqr0XmhjXXXPK_c9_104614.jpg_210x210.jpg
20652856932,599.0,599.0,New Balance/新百伦 女鞋 复古鞋 S470AWC0 S470AWB0,http://img02.taobaocdn.com/bao/uploaded/i2/T1t.r0XcReXXXlmoU__111047.jpg_210x210.jpg
16216869690,699.0,699.0,Newbalance/新百伦 女鞋 跑步鞋WR820BP0 轻便透气耐磨跑鞋 包邮,http://img01.taobaocdn.com/bao/uploaded/i1/T11If1XgphXXbMjXPb_122701.jpg_210x210.jpg
20603180250,559.0,559.0,New Balance/新百伦 女鞋 跑步鞋 休闲运动鞋WR663WSO,http://img03.taobaocdn.com/bao/uploaded/i3/T1isnZXh8iXXXC8_I2_045420.jpg_210x210.jpg
12923596802,759.0,759.0,New Balance/新百伦 男鞋 复古鞋 跑步鞋 H710R000/H710F000包邮,http://img04.taobaocdn.com/bao/uploaded/i4/T180YZXa8iXXbEyHM6_060735.jpg_210x210.jpg
16866079713,699.0,699.0,NewBalance/新百伦 女鞋 经典户外健步鞋 跑步鞋WW880PL0 新品,http://img01.taobaocdn.com/bao/uploaded/i1/T1ciPFXlxlXXc5evQ5_055621.jpg_210x210.jpg
18803848977,459.0,459.0,NewBalance/新百伦 男鞋 户外运动鞋 透气跑步鞋 MT310GR2新品,http://img04.taobaocdn.com/bao/uploaded/i4/T1.ofvXgJhXXbYOhw3_050252.jpg_210x210.jpg
17564859500,759.0,759.0,newbalance/新百伦 WT10BL00 女鞋-越野跑步鞋 包邮,http://img04.taobaocdn.com/bao/uploaded/i4/T15er2XeVaXXcxvGDX_113919.jpg_210x210.jpg
18804100778,459.0,459.0,New Balance/新百伦 女鞋 网面透气跑步鞋 WT310GP2,http://img01.taobaocdn.com/bao/uploaded/i1/T1iULvXftgXXcbBWI2_043146.jpg_210x210.jpg
16289037210,659.0,659.0,New Balance/新百伦女鞋复古运动鞋WH710HBP,http://img01.taobaocdn.com/bao/uploaded/i1/T1ED_0XftdXXbZoSrb_094905.jpg_210x210.jpg
15514574960,559.0,559.0,NewBalance/新百伦 情侣鞋 复古跑步鞋UL410BRB 新品,http://img03.taobaocdn.com/bao/uploaded/i3/T1Cc_AXexbXXcBw5EY_030018.jpg_210x210.jpg
16285678786,550.0,550.0,New Balance/新百伦 女鞋 运动跑步鞋 WR50WSB0正品,http://img01.taobaocdn.com/bao/uploaded/i1/T1KQr1XgNXXXbtRPbb_094500.jpg_210x210.jpg
16241945547,759.0,759.0,New Balance/新百伦 情侣鞋 复古鞋H710W000 百搭休闲潮鞋 白色,http://img01.taobaocdn.com/bao/uploaded/i1/T1wmz0Xc8iXXXfuLHa_121107.jpg_210x210.jpg
16214062250,399.0,399.0,newbalance/新百伦 男鞋 复古鞋 ML321GG0/GR0 百搭有型休闲板鞋,http://img02.taobaocdn.com/bao/uploaded/i2/T18CY1Xg4bXXbBn46b_124335.jpg_210x210.jpg
20496560355,699.0,699.0,newbalance/新百伦 男鞋 跑步鞋 MR70SRW0 时尚潮款运动鞋 包邮,http://img01.taobaocdn.com/bao/uploaded/i1/T12DHUXe8oXXbmzgDb_124150.jpg_210x210.jpg
20485708042,659.0,659.0,newbalance/新百伦 男鞋 健步鞋 MW610BR0 MW610GR0,http://img03.taobaocdn.com/bao/uploaded/i3/T1leY1XnteXXa0pfDb_124027.jpg_210x210.jpg
16213954664,559.0,559.0,Newbalance/新百伦 男鞋 多功能训练鞋 MX624OD0 nb包邮,http://img02.taobaocdn.com/bao/uploaded/i2/T1w1_0XXRlXXX0PMDb_123851.jpg_210x210.jpg
20485496381,459.0,459.0,newbalance/新百伦 女鞋 复古鞋W366RP00 经典舒适跑步鞋 包邮,http://img01.taobaocdn.com/bao/uploaded/i1/T1e3rVXcVmXXbPFu2b_123644.jpg_210x210.jpg
9172882837,599.0,599.0,NewBalance/新百伦 女鞋 复古鞋 跑步鞋 休闲运动鞋 W595DRW0,http://img03.taobaocdn.com/bao/uploaded/i3/T1ijukXoVtXXcK7ZUV_020117.jpg_210x210.jpg
20503524200,759.0,759.0,newbalance/新百伦 WR10OG00 女鞋 跑步鞋 极致超轻专业跑鞋包邮,http://img02.taobaocdn.com/bao/uploaded/i2/T1IOYTXkJoXXaysdTb_123513.jpg_210x210.jpg
16214102744,799.0,799.0,newbalance/新百伦 女鞋竞赛鞋WR1400NY炫酷配色超轻专业跑鞋包邮,http://img02.taobaocdn.com/bao/uploaded/i2/T10vD0XlhkXXXpNbzb_122917.jpg_210x210.jpg
16205294679,599.0,599.0,New Balance/新百伦 女鞋 跑步鞋WT101PH0 舒适透气保暖 包邮,http://img03.taobaocdn.com/bao/uploaded/i3/T1Sov1XeFbXXav8.Da_122537.jpg_210x210.jpg
16210786444,459.0,459.0,newbalance/新百伦女鞋跑步鞋 WT373PG0 户外越野跑鞋 经久耐穿,http://img01.taobaocdn.com/bao/uploaded/i1/T10QH0XdtjXXc6FTza_122412.jpg_210x210.jpg
20503176982,659.0,659.0,newbalance/新百伦 女鞋 健步鞋WW855GP0 防滑耐磨户外休闲运动鞋,http://img02.taobaocdn.com/bao/uploaded/i2/T1Kjn1Xn4bXXb1ASLa_122307.jpg_210x210.jpg
16216905184,999.0,999.0,newbalance/新百伦 女鞋 户外鞋 休闲运动鞋 WW978GT0 经典款,http://img01.taobaocdn.com/bao/uploaded/i1/T1eRv1XnVbXXbpiBra_122128.jpg_210x210.jpg
17564955619,559.0,559.0,newbalance/新百伦 WX624OD0  女鞋-多功能训练鞋,http://img02.taobaocdn.com/bao/uploaded/i2/T1fn60XlFgXXX0SAja_122003.jpg_210x210.jpg
18670296616,619.0,619.0,NewBalance/新百伦百搭男鞋 复古鞋 运动跑步鞋ML574FJT 7折包邮,http://img04.taobaocdn.com/bao/uploaded/i4/T1T1TvXlVmXXcPsx74_053255.jpg_210x210.jpg
16558275037,699.0,699.0,NewBalance/新百伦女鞋跑步鞋 网面透气运动鞋W660SP20特价正品,http://img01.taobaocdn.com/bao/uploaded/i1/T1egryXhXbXXb5SPg1_041615.jpg_210x210.jpg
16557815834,699.0,699.0,NewBalance/新百伦 男鞋 网面透气减震跑步鞋M660GR2,http://img03.taobaocdn.com/bao/uploaded/i3/T1qUYrXeXtXXXSiMw0_035319.jpg_210x210.jpg
17666055877,498.0,498.0,New Balance/新百伦 龙服 长袖针织外套 AMHJ2001-610/720/001,http://img02.taobaocdn.com/bao/uploaded/i2/T1VjL1XnBaXXayTl3T_012707.jpg_210x210.jpg
18088612200,619.0,619.0,NewBalance/新百伦 情侣鞋 男鞋女鞋复古减震跑步鞋M574BKJ0 新品,http://img04.taobaocdn.com/bao/uploaded/i4/T1EMnjXjNsXXbeXcTX_114511.jpg_210x210.jpg
8851012445,799.0,799.0,New Balance/新百伦女鞋中筒雪地靴CW710BE0/CW710BP0/CW710BR0,http://img02.taobaocdn.com/bao/uploaded/i2/T1wArVXeFmXXcrnsYa_120443.jpg_210x210.jpg
9959372317,799.0,799.0,New Balance/新百伦 男鞋 复古鞋 M850GB00/M850OL00,http://img02.taobaocdn.com/bao/uploaded/i2/T1etG0XoxkXXax3TIZ_033611.jpg_210x210.jpg
16279097015,899.0,899.0,New Balance/新百伦 男鞋 健步鞋 MW780JTP,http://img04.taobaocdn.com/bao/uploaded/i4/T1MVH0XjXgXXcu4ajb_093047.jpg_210x210.jpg
12820505252,759.0,759.0,New Balance/新百伦 女鞋 健步鞋 WW910BR0 包邮,http://img03.taobaocdn.com/bao/uploaded/i3/T1BTasXexXXXbeuY30_034439.jpg_210x210.jpg
12820949832,999.0,999.0,New Balance/新百伦 情侣款 竞赛鞋 专业跑鞋 RT1100RB 包邮,http://img01.taobaocdn.com/bao/uploaded/i1/T1S9asXlpfXXXJVQZZ_032944.jpg_210x210.jpg
12313223103,599.0,599.0,New Balance/新百伦 女鞋 复古鞋 W690BL10,http://img03.taobaocdn.com/bao/uploaded/i3/T1DtikXo0oXXX9XrM4_052149.jpg_210x210.jpg
12287190384,499.0,499.0,New Balance/新百伦 女鞋 跑步鞋 W440BR10,http://img04.taobaocdn.com/bao/uploaded/i4/T1R3h6XcJBXXbEXfsU_014505.jpg_210x210.jpg
8852160033,659.0,650.0,New Balance/新百伦 女鞋复古休闲鞋 WH710HGB,http://img02.taobaocdn.com/bao/uploaded/i2/T1TfykXkpDXXcjZZoZ_031552.jpg_210x210.jpg
10839764995,449.5,899.0,Newbalance/新百伦 女鞋 户外探险鞋 WO1000BB 包邮,http://img02.taobaocdn.com/bao/uploaded/i2/T1mLSkXbNuXXbAxlna_092125.jpg_210x210.jpg
12282142040,619.0,619.0,New Balance/新百伦 女鞋复古鞋 WR574API,http://img02.taobaocdn.com/bao/uploaded/i2/T1I4x6XoNEXXcErOZ6_062245.jpg_210x210.jpg
13756130137,599.0,599.0,New Balance/新百伦 女鞋 健步鞋 WW358CB0,http://img04.taobaocdn.com/bao/uploaded/i4/T1RIu0XaBdXXcqHigW_023732.jpg_210x210.jpg
9956553343,499.0,499.0,New Balance/新百伦 女款 健步鞋 WW359WI0,http://img02.taobaocdn.com/bao/uploaded/i2/T1QHp6Xo8DXXcDW6MZ_032810.jpg_210x210.jpg
12748770775,899.0,899.0,New Balance/新百伦 女鞋 健步鞋 WW780JOL,http://img04.taobaocdn.com/bao/uploaded/i4/T1ATWqXhXXXXbAE6IZ_033102.jpg_210x210.jpg
15915814455,599.0,599.0,NewBalance/新百伦 情侣运动鞋 经典跑步鞋 M564R000/B000,http://img01.taobaocdn.com/bao/uploaded/i1/T1dynEXdxpXXc4qosW_025122.jpg_210x210.jpg
16210242852,459.0,459.0,New Balance/新百伦 男鞋 复古休闲板鞋CT272SB0 CT272BK0包邮,http://img03.taobaocdn.com/bao/uploaded/i3/T1L92WXoBfXXbq3UE__111028.jpg_210x210.jpg
19048824147,459.0,459.0,NewBalance/新百伦 女鞋 时尚轻便跑步鞋 经典款W380GP20正品特价,http://img04.taobaocdn.com/bao/uploaded/i4/T1kWvAXlFbXXXkeaZW_022506.jpg_210x210.jpg
13028623617,759.0,759.0,New Balance/新百伦 男鞋 休闲鞋 健步鞋MW910BR0,http://img03.taobaocdn.com/bao/uploaded/i3/T1Nvq0XgRgXXaKzO7V_020906.jpg_210x210.jpg
15592224979,559.0,559.0,New Balance/新百伦 男鞋越野跑步鞋 MT610BL0,http://img01.taobaocdn.com/bao/uploaded/i1/T1oPSZXg8tXXa5JAk._113121.jpg_210x210.jpg
15020508452,699.0,699.0,New Balance/新百伦 男鞋 复古鞋 ML581AT0/ML581BK0 包邮,http://img01.taobaocdn.com/bao/uploaded/i1/T1FWm0Xk8fXXXx.dg._111623.jpg_210x210.jpg
13481500014,619.0,619.0,New Balance/新百伦 男鞋 复古鞋 ML574CCR,http://img04.taobaocdn.com/bao/uploaded/i4/T1eau0XopsXXXrVYs2_042945.jpg_210x210.jpg
19048564290,459.0,459.0,NewBalance/新百伦 男鞋跑步鞋 舒适透气休闲运动鞋M380SV20,http://img03.taobaocdn.com/bao/uploaded/i3/T1zozpXdFjXXbvD.QV_021928.jpg_210x210.jpg
20482088882,499.0,499.0,Newbalance/新百伦 男鞋 跑步鞋 耐磨透气跑鞋 MR340BK1包邮,http://img04.taobaocdn.com/bao/uploaded/i4/T1kj6ZXmBgXXbTMeoZ_031820.jpg_210x210.jpg
20483712490,699.0,699.0,Newbalance/新百伦 男鞋 跑步鞋 防滑耐磨高性价比跑鞋MR670BL1,http://img02.taobaocdn.com/bao/uploaded/i2/T1jlY0XbVcXXbzrW.Z_031406.jpg_210x210.jpg
16203790594,459.0,459.0,Newbalance/新百伦 男鞋 越野跑步鞋 MT373BY0 包邮,http://img02.taobaocdn.com/bao/uploaded/i2/T13YP0XlhfXXXXzTIY_030649.jpg_210x210.jpg
18780996617,619.0,619.0,New Balance/新百伦 男鞋 休闲鞋 复古跑步鞋ML574FPT 新品特价,http://img03.taobaocdn.com/bao/uploaded/i3/T1W4_vXk0hXXXm1DZW_025051.jpg_210x210.jpg
20483612136,559.0,559.0,newbalance/新百伦 情侣鞋 复古鞋 跑步鞋 U410BUR0/U410OLI0,http://img04.taobaocdn.com/bao/uploaded/i4/T1q760XXtdXXawVmwW_024559.jpg_210x210.jpg
17552059338,499.0,499.0,Newbalance/新百伦 女鞋 复古鞋 轻便透气跑步鞋W556BBT0 包邮,http://img04.taobaocdn.com/bao/uploaded/i4/T194b0XhpcXXX2ziAW_023757.jpg_210x210.jpg
20483228419,499.0,499.0,Newbalance/新百伦 女鞋 跑步鞋 防滑耐磨跑鞋 WR340BK1 包邮,http://img02.taobaocdn.com/bao/uploaded/i2/T1mc2ZXddlXXa5buAW_022951.jpg_210x210.jpg
16207873543,619.0,619.0,Newbalance/新百伦 男鞋 复古鞋 跑步鞋 ML574GC0/ML574NC0 包邮,http://img01.taobaocdn.com/bao/uploaded/i1/T1_MD0XjVcXXX1pUPa_122552.jpg_210x210.jpg
14979254043,699.0,699.0,New Balance/新百伦 情侣鞋 复古鞋 M850KBG0 M850KGG0 M850KRG0,http://img02.taobaocdn.com/bao/uploaded/i2/T1DSYiXkFcXXb2n7EW_024332.jpg_210x210.jpg
12281898596,599.0,599.0,New Balance/新百伦 正品男鞋 跑步鞋 运动鞋 慢跑鞋 M690BL10,http://img04.taobaocdn.com/bao/uploaded/i4/T1TBvZXhdgXXb1Opc__104853.jpg_210x210.jpg
17631951316,659.0,659.0,New Balance/新百伦 男鞋 跑步鞋 防滑耐磨 M560BK20 包邮,http://img01.taobaocdn.com/bao/uploaded/i1/T11ivZXeNiXXcVGPTa_091633.jpg_210x210.jpg
20484216797,559.0,559.0,Newbalance/新百伦 男鞋 跑步鞋 M630BH20/M630SR20,http://img03.taobaocdn.com/bao/uploaded/i3/T1w9rYXkRkXXbGlWTX_084243.jpg_210x210.jpg
16960912501,499.0,499.0,New Balance新百伦 情侣鞋 跑步鞋M400SRK0 M400SGB0,http://img03.taobaocdn.com/bao/uploaded/i3/T1PRmJXXVpXXb4a8oW_024426.jpg_210x210.jpg
17668051420,198.0,198.0,New Balance/新百伦 女款无袖运动背心 AWZT9254,http://img04.taobaocdn.com/bao/uploaded/i4/T11YD0XiXeXXcL4vk1_040815.jpg_210x210.jpg
20661684384,298.0,298.0,newbalance 新百伦 女款长袖针织衫 AWHF0330,http://img03.taobaocdn.com/bao/uploaded/i3/T1KEz0XjtfXXakzMva_121212.jpg_210x210.jpg
16290210521,298.0,298.0,newbalance 新百伦 女款长袖套衫 AWFT0311-018/209,http://img04.taobaocdn.com/bao/uploaded/i4/T1aG_1XhFfXXX9fvTb_124048.jpg_210x210.jpg
16290298615,328.0,328.0,newbalance 新百伦 女款长袖针织外套 AWFJ0105-521/607,http://img02.taobaocdn.com/bao/uploaded/i2/T1eYr1XbBeXXar9_zb_125338.jpg_210x210.jpg
20662344749,428.0,428.0,newbalance 新百伦 女款外套 AWFJ0101,http://img04.taobaocdn.com/bao/uploaded/i4/T1_b_1XatdXXXudVLc_125618.jpg_210x210.jpg
20662596079,298.0,298.0,New Balance/新百伦 女款 T恤 AWET9171-610/100,http://img01.taobaocdn.com/bao/uploaded/i1/T1Ggn0XgJiXXX6m9wS_010124.jpg_210x210.jpg
15712447761,759.0,759.0,New Balance/新百伦 男鞋 复古鞋 H710BRB0,http://img04.taobaocdn.com/bao/uploaded/i4/T1eR_dXeplXXbKkJA5_055331.jpg_210x210.jpg
15074847012,459.0,459.0,New Balance/新百伦 情侣鞋 复古板鞋 PROCTOL0 PROCTDG0,http://img04.taobaocdn.com/bao/uploaded/i4/T1YCi7XotaXXaG9po6_060436.jpg_210x210.jpg
13564761344,459.0,459.0,NewBalance/新百伦女鞋 新品 网面复古跑步鞋 W373BF00 专柜正品,http://img04.taobaocdn.com/bao/uploaded/i4/T1A_OZXbdnXXcbqJAZ_032014.jpg_210x210.jpg
14345854099,499.0,499.0,New Balance/新百伦 情侣鞋 男/女鞋 复古板鞋PROHIBS 包邮,http://img02.taobaocdn.com/bao/uploaded/i2/T1J0S7XeJsXXakSHZ2_043321.jpg_210x210.jpg
14026811109,459.0,459.0,New Balance/新百伦 男鞋 经典复古跑步鞋 M366BK00 新品7折,http://img01.taobaocdn.com/bao/uploaded/i1/T17.9_XidpXXax1wLX_115308.jpg_210x210.jpg
14282347006,559.0,559.0,NewBalance/新百伦情侣鞋 男鞋运动休闲板鞋 AJJMB AJJ 新品7折,http://img03.taobaocdn.com/bao/uploaded/i3/T10Wm0XalfXXcTQM78_100603.jpg_210x210.jpg
15592456843,599.0,599.0,New Balance/新百伦休闲复古鞋 经典网布情侣款低帮鞋U420SBK/SGB,http://img03.taobaocdn.com/bao/uploaded/i3/T1G_iZXdRoXXb1mXc0_033801.jpg_210x210.jpg
12456830470,459.0,459.0,New Balance/新百伦 情侣鞋 复古鞋 M365LG00/M365LB00/M365LR00,http://img03.taobaocdn.com/bao/uploaded/i3/T1n_b2XhBgXXaGD5s8_100754.jpg_210x210.jpg
13588409674,559.0,559.0,NewBalance/新百伦 情侣款男鞋休闲运动鞋 女鞋透气跑步鞋U410MGR,http://img03.taobaocdn.com/bao/uploaded/i3/T1go9ZXotkXXalRPI0_035730.jpg_210x210.jpg
17693567145,328.0,328.0,NewBalance/新百伦 女衣 - 梭织长裤 WRP03390,http://img02.taobaocdn.com/bao/uploaded/i2/T1bv_TXidrXXXNiio9_103703.jpg_210x210.jpg
10464714081,399.0,399.0,NewBalance/新百伦 情侣鞋 帆布板鞋 V45LB000 男女款休闲鞋,http://img02.taobaocdn.com/bao/uploaded/i2/T1lkPhXeBiXXX_5Y74_052214.jpg_210x210.jpg
16558043766,559.0,559.0,NewBalance/新百伦 情侣鞋 复古跑步鞋男鞋 新品 U410NBY 7折包邮,http://img03.taobaocdn.com/bao/uploaded/i3/T1ZQTrXlhuXXaM9dE1_040605.jpg_210x210.jpg
12371452335,599.0,599.0,NewBalance/新百伦 男鞋 新品 复古跑步鞋 透气运动鞋 M595PBG0,http://img01.taobaocdn.com/bao/uploaded/i1/T1OQ6kXiBeXXc9_sIT_010918.jpg_210x210.jpg
