淘宝ID,价格,专柜价,标题,图片
15066160958,459.0,459.0,NewBalance/新百伦 新品男鞋 跑步鞋 休闲复古鞋 M373CR00/NG00,http://img04.taobaocdn.com/bao/uploaded/i4/T1eSOZXfxmXXXGFzU9_104200.jpg_210x210.jpg
13612702117,459.0,459.0,NewBalance/新百伦男鞋休闲跑步鞋 仿皮复古鞋M364LBK0/LBR0特价,http://img04.taobaocdn.com/bao/uploaded/i4/T1Xu10XkViXXcK_1Z1_040753.jpg_210x210.jpg
13757185807,390.0,390.0,NewBalance/新百伦 男鞋透气休闲运动跑步鞋复古鞋 MR300YK0,http://img03.taobaocdn.com/bao/uploaded/i3/T1VKeQXi8XXXbDNn7W_025058.jpg_210x210.jpg
13029295888,619.0,619.0,New Balance/新百伦 男款复古鞋 ML574HGB/ML574HBK 包邮,http://img02.taobaocdn.com/bao/uploaded/i2/T1IPasXd4BXXbTydAW_023133.jpg_210x210.jpg
14026747126,459.0,459.0,NewBalance/新百伦 女鞋 透气经典复古跑步鞋W366BK00 新品,http://img01.taobaocdn.com/bao/uploaded/i1/T17.9_XidpXXax1wLX_115308.jpg_210x210.jpg
12549250703,619.0,619.0,New Balance/新百伦 男鞋 复古鞋 跑步鞋 ML574FRD 包邮,http://img01.taobaocdn.com/bao/uploaded/i1/T1HzC0XopaXXcuMns6_063130.jpg_210x210.jpg
13481516445,619.0,619.0,New Balance/新百伦 男鞋 复古鞋 跑步鞋 ML574BNV 包邮,http://img04.taobaocdn.com/bao/uploaded/i4/T1G9CZXXxnXXb1ppE._110845.jpg_210x210.jpg
20606904486,659.0,659.0,New Balance/新百伦 男鞋跑步鞋 运动鞋复古鞋 NB574WB0 正品,http://img01.taobaocdn.com/bao/uploaded/i1/T1f6LLXn0pXXbmMCkY_030501.jpg_210x210.jpg
13757445387,390.0,390.0,New Balance/新百伦 女鞋 耐磨透气休闲跑步鞋 WR300GP0特价包邮,http://img04.taobaocdn.com/bao/uploaded/i4/T13naZXohnXXatSpwY_024950.jpg_210x210.jpg
13650242868,559.0,559.0,New Balance/新百伦 男鞋避震跑步鞋 M470BW20 新品,http://img01.taobaocdn.com/bao/uploaded/i1/T1ANWMXiloXXbNJ7Q__110237.jpg_210x210.jpg
13591858994,659.0,659.0,New Balance/新百伦超耐磨女鞋 运动款跑步鞋W560BK20 特价包邮,http://img01.taobaocdn.com/bao/uploaded/i1/T1NpG0XfdjXXanKbQZ_031501.jpg_210x210.jpg
14399742066,499.0,499.0,New Balance/新百伦经典跑步女鞋 运动鞋W590SP10 NB正品包邮,http://img03.taobaocdn.com/bao/uploaded/i3/T1gJa9XnpaXXXZi4w7_065013.jpg_210x210.jpg
14397939617,659.0,659.0,New Balance/新百伦 女鞋 避震跑步鞋 运动鞋W820WP20/W820BP20,http://img02.taobaocdn.com/bao/uploaded/i2/T1Ope0XbFkXXaO4psZ_030901.jpg_210x210.jpg
14069698976,559.0,559.0,NewBalance/新百伦 女鞋 粗格网眼轻量跑鞋 W630GP00 W630SG10,http://img01.taobaocdn.com/bao/uploaded/i1/T1PGiZXklsXXXXmjE8_100917.jpg_210x210.jpg
16055272813,559.0,559.0,New Balance/新百伦男鞋 专业轻量跑步鞋M630NW10 M630RG10,http://img02.taobaocdn.com/bao/uploaded/i2/T1PeKZXoRfXXcnM1I1_041030.jpg_210x210.jpg
17332740967,399.0,399.0,NewBalance/新百伦 情侣鞋 男鞋/女鞋休闲板鞋 透气潮鞋 V45CNY,http://img03.taobaocdn.com/bao/uploaded/i3/T1GyjcXeNXXXcNl..3_051527.jpg_210x210.jpg
14971124643,499.0,499.0,New Balance/新百伦男鞋运动鞋越野跑步鞋 新品 户外鞋MT503JS,http://img04.taobaocdn.com/bao/uploaded/i4/T1SFm0XmFhXXazQlc._112930.jpg_210x210.jpg
13842961450,659.0,659.0,New Balance/新百伦 男鞋 休闲鞋健步鞋 MW865BK0/MW865GB0,http://img01.taobaocdn.com/bao/uploaded/i1/T13Wy0XbViXXbnbvM1_040848.jpg_210x210.jpg
14069994495,659.0,659.0,New Balance/新百伦 女鞋跑步鞋透气健步鞋 WW865PV0/BP0/GV0包邮,http://img01.taobaocdn.com/bao/uploaded/i1/T1Pg5ZXjxeXXbk3R39_104448.jpg_210x210.jpg
14701579325,759.0,759.0,潮款网面 New Balance/新百伦塑身健步鞋WW885BK0女鞋 运动跑步鞋,http://img01.taobaocdn.com/bao/uploaded/i1/T174uZXk0dXXX2wYE__105457.jpg_210x210.jpg
13563390189,599.0,599.0,NewBalance/新百伦 男复古鞋 透气网面跑步鞋 ML671BR0 正品,http://img02.taobaocdn.com/bao/uploaded/i2/T1uDiZXm4lXXbIbLk._111859.jpg_210x210.jpg
16531556913,559.0,559.0,New Balance/新百伦 男鞋 跑步鞋 运动鞋 M680WB10,http://img03.taobaocdn.com/bao/uploaded/i3/T1ady6XftbXXX5Csk9_102624.jpg_210x210.jpg
14570462057,459.0,459.0,NewBalance/新百伦 男鞋 网面透气休闲运动跑步鞋MR360GG1正品,http://img04.taobaocdn.com/bao/uploaded/i4/T1KTYaXdlaXXa2m3M5_055734.jpg_210x210.jpg
14574089077,659.0,659.0,New/Balance新百伦 男鞋 优质网面经典复古跑步鞋 ML751NR0正品,http://img03.taobaocdn.com/bao/uploaded/i3/T1K86aXgFcXXaJUxU4_052942.jpg_210x210.jpg
15260821225,559.0,559.0,New Balance/新百伦男鞋运动鞋 ML330NSS ML330GSN ML330GS0特价,http://img04.taobaocdn.com/bao/uploaded/i4/T150e6XaRdXXXRrRsS_010001.jpg_210x210.jpg
20619212984,499.0,499.0,NewBalance/新百伦 男鞋 透气跑步鞋避震 MR360B10 包邮,http://img01.taobaocdn.com/bao/uploaded/i1/T1Yrf1Xm0XXXbRAGPX_114237.jpg_210x210.jpg
17631731630,599.0,599.0,New Balance/新百伦 男鞋 轻便透气健步鞋 MW358TP0,http://img02.taobaocdn.com/bao/uploaded/i2/T1vejyXoBpXXasQZs6_060830.jpg_210x210.jpg
14826634616,499.0,499.0,New Balance/新百伦 男鞋 健步鞋 MW360NV0,http://img03.taobaocdn.com/bao/uploaded/i3/T1J5fdXjxqXXbAH8M4_054035.jpg_210x210.jpg
15255447996,499.0,499.0,NewBalance/新百伦男士酷鞋 户外跑步鞋M540SR10 M540WB10,http://img02.taobaocdn.com/bao/uploaded/i2/T1Nby.XeVdXXXcjpg__104855.jpg_210x210.jpg
16924572933,459.0,459.0,New Balance/新百伦轻便户外运动跑步鞋 W490PS10 女鞋 特价包邮,http://img01.taobaocdn.com/bao/uploaded/i1/T1dnu_XbJqXXbWHc6a_120455.jpg_210x210.jpg
14295854269,559.0,559.0,NewBalance/新百伦女鞋 跑步鞋 透气网面运动鞋W680WP10特价包邮,http://img02.taobaocdn.com/bao/uploaded/i2/T1FSK5XehqXXah2qs._110952.jpg_210x210.jpg
14683250065,599.0,599.0,newbalance/新百伦 女鞋 跑步鞋 防滑防臭透气WL881BL0 特价包邮,http://img01.taobaocdn.com/bao/uploaded/i1/T1QGjcXadiXXbUTLA1_041136.jpg_210x210.jpg
13001381278,699.0,699.0,New Balance/新百伦 女款健步鞋 WW780BR0,http://img03.taobaocdn.com/bao/uploaded/i3/T18UOvXmFmXXXHhO3V_021201.jpg_210x210.jpg
16292146242,268.0,268.0,New Balance/新百伦 夏季 男款 短袖POLO衫 AMTT0106,http://img01.taobaocdn.com/bao/uploaded/i1/T1VjfTXbJqXXXUINE1_041408.jpg_210x210.jpg
20665008800,248.0,248.0,New Balance/新百伦男款长袖圆领T恤AMAT1106包邮,http://img04.taobaocdn.com/bao/uploaded/i4/T1K.bZXaBmXXb8ljAZ_033057.jpg_210x210.jpg
17667551433,428.0,428.0,NewBalance/新百伦 女装长袖运动外套 AWHJ0315-787/501 正品,http://img02.taobaocdn.com/bao/uploaded/i2/T1KWH1XdBdXXczk5kZ_032616.jpg_210x210.jpg
20662604472,368.0,368.0,newbalance 新百伦 女款长袖针织外套 AWAT1114-690/100,http://img02.taobaocdn.com/bao/uploaded/i2/T1T_Y0XlFfXXbIusoT_010857.jpg_210x210.jpg
17666007165,428.0,428.0,NewBalance/新百伦 女款连帽针织套衫 AWAT1102 包邮,http://img01.taobaocdn.com/bao/uploaded/i1/T193n0XjBiXXbLa0wT_011316.jpg_210x210.jpg
16290598382,298.0,298.0,New Balance 新百伦 男式长袖针织套衫 T恤 AMHF0321-030/001,http://img02.taobaocdn.com/bao/uploaded/i2/T1rxT0XetiXXXYrT7T_012951.jpg_210x210.jpg
20663136354,248.0,248.0,newbalance/新百伦 新百伦 男款长袖T恤 AMAT1112,http://img02.taobaocdn.com/bao/uploaded/i2/T1Etj0XoxiXXb1ZYcU_013652.jpg_210x210.jpg
17666323105,428.0,428.0,newbalance 新百伦 男款长袖针织套衫 AMAT1102,http://img03.taobaocdn.com/bao/uploaded/i3/T1t6L1XbdbXXaX3JcU_013918.jpg_210x210.jpg
16289874194,698.0,698.0,newbalance 新百伦 女长袖套衫AWRJ0316,http://img02.taobaocdn.com/bao/uploaded/i2/T1eHf1XgleXXcblOYX_115559.jpg_210x210.jpg
12919752684,698.0,698.0,【新品】New Balance/新百伦 男款长袖梭织外套 AMLJ1305,http://img02.taobaocdn.com/bao/uploaded/i2/T1Ga5mXi8jXXaWt5AT_011951.jpg_210x210.jpg
12373020110,619.0,619.0,NewBalance/新百伦 女鞋 时尚撞色复古跑步鞋 WL574GBR/CSB新品,http://img04.taobaocdn.com/bao/uploaded/i4/T1hPrrXihdXXafkQQ8_101354.jpg_210x210.jpg
15414332061,659.0,659.0,NewBalance/新百伦男鞋跑步鞋 舒适透气复古鞋 NB574BS0 包邮,http://img04.taobaocdn.com/bao/uploaded/i4/T1Pui0XjpXXXXxH0g1_040541.jpg_210x210.jpg
